description,title,url,price,spider,image_urls,server,project,images,location,address,date
"- No Agent Fees - Property Reference Number: 321862 Newly refurbished and decorated 3 Bed Maisonette, spacious accommodation situated over two floors. With double glazing and gas central heating. New kitchen and bathroom suite. Entrance porch, opening onto the dining room with a walk in storage cupboard, large lounge room with adjacent kitchen area. There is a small balcony leading off the lounge and there are stairs leading up to the landing, with a bathroom/WC (new) and three large bedrooms one with built in wardrobes and another with a small balcony.. Outside there are landscaped communal gardens. Communal Entrance Entrance porch Dining Room Kitchen Lounge Room Balcony Upstairs landing Bedroom 1 Bedroom 2 Bedroom 3 Bathroom / WC Summary & Exclusions: - Rent Amount: £400.00 per month (£92.31 per week) - Deposit / Bond: £400.00 - 3 Bedrooms - 1 Bathrooms - Property comes unfurnished - Available to move in fromJanuary, 2018 - Minimum tenancy term is 6 months - Maximum number of tenants is 5 - DSS enquiries welcome - Students welcome to enquire - Pets considered / by arrangement - Smokers considered - Family Friendly - Bills not included - No Parking Available - No Garden Access - EPC Rating: E If calling, please quote reference: 321862 Fees: You will not be charged any admin fees. Referencing for tenants only costs £20 each, if requested by the landlord for this property. ** Contact today to book a viewing and have the landlord show you round! ** Request Details form responded to 24/7, with phone bookings available 9am-9pm, 7 days a week. OpenRent Ref: 321862 Agent: OpenRent Agent Ref: Reference_Number_321862","3 Bedroom Flat In Wellington Walk, Washington, Ne37 (3 Bed)",https://www.gumtree.com/p/property-to-rent/3-bedroom-flat-in-wellington-walk-washington-ne37-3-bed-/1280207333,[400.0],easy,https://i.ebayimg.com/00/s/NjgyWDEwMjQ=/z/dGUAAOSwiBJaOn1j/$_86.JPG,umair-ThinkPad-T420,properties,,,"Washington, Tyne and Wear","[datetime.datetime(2017, 12, 28, 18, 18, 12, 859821)]"
This room is located in a well-run house a few minutes from Tuffnell Park tube station (Zone 2) on Northern Line and the No. 4 bus route. Council Tax and Electricity payable and seasonal heating is included in the rent. There is a six months minimum contract and a deposit of £700. is payable. Work and landlord's references are required. This will suit a young professional or guaranteed student. No Agents or DSS.,Single Furnished Spacious Bedsitter With Built-In Kitchen,https://www.gumtree.com/p/property-to-rent/-single-furnished-spacious-bedsitter-with-built-in-kitchen/1280063655,[600.0],easy,https://i.ebayimg.com/00/s/NzY4WDEwMjQ=/z/QtAAAOSwIFtaOOrq/$_86.JPG,umair-ThinkPad-T420,properties,,,"Camden, London","[datetime.datetime(2017, 12, 28, 18, 18, 13, 31148)]"
4 bedroom four in a block large garden looking for 3 or 4 bed Livingston and surrounding areas to be near family,Home Swap From Ml8 To Eh54,https://www.gumtree.com/p/home-swap/home-swap-from-ml8-to-eh54/1280799156,,easy,https://www.gumtree.com/p/home-swap/home-swap-from-ml8-to-eh54/1280799156,umair-ThinkPad-T420,properties,,,"Carluke, South Lanarkshire","[datetime.datetime(2017, 12, 28, 18, 18, 13, 84205)]"
"LARGE AIRY AND SPACIOUS DOUBLE ROOM HAVING DOUBLE BED, FULLY CARPETED,TWO SIDE available to single person for £550 the rent is paid monthly and will be £600for a couple. The room has :TABLES, TWO WOODEN CHEST OF DRAWERS,TWO WARDROBES, ROOM FRIDGE, DUVET, PILLOWS AND BED COVER/DUVET COVER.  ALL BILLS AND COUNCIL TAX IS INCLUDED  THE HOUSE ITSELF IS CENTRALLY HEATED, WE HAVE MODERN ELECTRIC HOB, KETTLE, SANDWICH MAKER, MICROWAVE OVEN,JUICER ETC TO SHARE TOO.WASHING MACHINE AND TUMBLE DRYER AVAILABLE TO SHARE TOO  THERE ARE THREE ROOMS.WE ARE THREE PEROPLE LIVING IN PROPERTY AND YOUR ROOM IS COMPLETELY PRIVATE.  THE WINDOW IN YOUR ROOM OPENS UP TO LOVELY GARDEN AND MAKES IT AIRY.  THERE IS FREE PARKING SPACE IN THE STREET.  ALSO THE TRANSPORT LINKS ARE EXCELLENT. WITH STREATHAM STATION JUST OVER 5MINUTES WALK. HIGH STREET 7-8 MINUTE WALK.SEVERAL HOTELS AND GIANT TESCO EXTRA IS NEXT TO STREATHAM STATION FOR EVERY DAY NEEDS. SEVERAL CAFES, KFC, SUBWAY AND CHICKEN COTTAGE ALL ON WLKING DISTANCE OF ABOUT 7-8 MINUTES.  CENTRAL LONDON IS ONLY 23 MINUTES AWAY VIA TRAIN  ALL OF US WORK AND WANT SOMEONE PROFESSIONAL AND RESPONSIBLE TO LIVE WITH US.  THE ROOM IS AVAILABLE FOR SINGLE AND COUPLE BOTH.  DATE AVAILABLE 05/12/2017  FOR VIEWING CONTACT DURRANI 07404040008  NOTE: NO PETS /CHILDREN PLEASE Short term tenancy welcome We are open to negotiations on that",Spacious Double Room Available For Professional Couple Or Single Person Short Or Long Term Welcome,https://www.gumtree.com/p/property-to-share/spacious-double-room-available-for-professional-couple-or-single-person-short-or-long-term-welcome/1273108491,[600.0],easy,https://i.ebayimg.com/00/s/MTAyNFg2MDg=/z/aIwAAOSwfjRZ9kE2/$_86.JPG,umair-ThinkPad-T420,properties,,,"Streatham Common, London","[datetime.datetime(2017, 12, 28, 18, 18, 13, 122102)]"
WHAT'S INCLUDED IN THE RENT?   • All bills.  • 24/7 high speed WiFi.  • Cleaners 7 days a week.  • Free vegetarian meals.    COMPLIMENTARY FOR RESIDENTS   • Breakfast.  • Dinner.  • Lunch (weekends only).  • Organic milk.  • Fresh fruits.  • Water Filter System for drinking water.   ROOMS   • Single or shared room option.  • Beautiful large wardrobes.  • Which recommended &quot;Best Buy&quot; mattress.  • Desk & swivel chair.  • Laminate flooring.    FREE HARE KRISHNA FOOD!  • No frozen food: only fresh vegetables are used.  • We avoid using tins & cans.  • Best quality ingredients used.  • Careful consideration given to the nutritional value of ingredients used.  • Items free from artificial colours & preservatives preferred.  • No genetically modified ingredients used.  • We never cook using microwave.  • Meals are prepared fresh daily.  • We make our own organic yoghurt.  • There is no commercial motive in running our kitchen.  • Our hygiene standards are none other than excellent. It’s too good to be true!    We are a registered charity and a non profit making organisation.  Phone us to come and have a look around...  Rooms allocated on a first come first serve basis. ,5 Mins Walk Harrow Tube Including Veggie Meals,https://www.gumtree.com/p/property-to-share/5-mins-walk-harrow-tube-including-veggie-meals/1274994079,[745.0],easy,https://i.ebayimg.com/00/s/MzIxWDEwMjQ=/z/DgEAAOSwLJ9aBxsd/$_86.JPG,umair-ThinkPad-T420,properties,,,"Harrow, London","[datetime.datetime(2017, 12, 28, 18, 18, 13, 170681)]"
"This room with its own built-in kitchen is located on the first floor of a well-maintained house a few minutes from shops, restaurants and buses. It is a 15 minute walk to Golders Green Tube Station. All bills are included except electricity. Seasonal central heating is included in the rent. There is a six months minimum contract and references and a deposit of £620. are required. This will suit a guaranteed student or young professional. No Agents or DSS.",Small Clean Furnished Single Bedsitter In Bridge Lane,https://www.gumtree.com/p/property-to-rent/small-clean-furnished-single-bedsitter-in-bridge-lane/1272950666,[520.0],easy,https://i.ebayimg.com/00/s/NzY4WDEwMjQ=/z/fDAAAOSw4nhZ9Mc4/$_86.JPG,umair-ThinkPad-T420,properties,,,"Golders Green, London","[datetime.datetime(2017, 12, 28, 18, 18, 13, 278282)]"
"Self Storage containers for rent, Exeter and surrounding areas. Situated in Exeter, very accessible, in a secure yard with 24hr security on site plus security cameras.  We also have three other sites with storage containers available.  For long or short term rent £80 per month.  Short or long term let.  For more information please do not hesitate to contact Brett",Storage Containers For Rent 160Sq Ft 24/7 Access With 24Hr Security,https://www.gumtree.com/p/garage-parking-to-rent/storage-containers-for-rent-160sq-ft-24-7-access-with-24hr-security/1203728519,[80.0],easy,https://i.ebayimg.com/00/s/NjAwWDgwMA==/z/~swAAOSwo4pYRye1/$_86.JPG,umair-ThinkPad-T420,properties,,,"Exeter, Devon","[datetime.datetime(2017, 12, 28, 18, 18, 13, 372194)]"
Hi i have a modern new build two bedroom flat in the anniesland area of glasgow west end it is a beautiful flat with all new mods & cons open plan spacious bright recently decorated to a high standard with an added bonus office study box room that runs of the living room i have took a few pics but viewing is essential for this flat it is a council property with great neighbours very quiet & peaceful walking distance to all shops & transport links i am looking to swap or exchange for a house with a garden would consider all areas please email me with what you have to swap & a contact number & i will get back to you cheers :)              7,Two Bedroom New Build Flat In The Anniesland Area Of Glasgow Looking To Swap/Exchange,https://www.gumtree.com/p/home-swap/two-bedroom-new-build-flat-in-the-anniesland-area-of-glasgow-looking-to-swap-exchange-/1277563565,,easy,https://i.ebayimg.com/00/s/ODAwWDYwMA==/z/0jEAAOSw5dlaIwIU/$_86.JPG,umair-ThinkPad-T420,properties,,,Glasgow,"[datetime.datetime(2017, 12, 28, 18, 18, 13, 508694)]"
"Room Only (Shared House) - No Agent Fees - Property Reference Number: 321934 Large Double room with its own shower and toilet and mini kitchen with fridge. Cooking and washing facilities are located in the shared kitchen and dining area. The rent includes all bills other than electricity. Wifi is also included. The property is well located within a 5 minute walk from Lewisham hospital, walking distance from Catford rail station. The rooms will be available to move in from the 23/12/2017. Summary & Exclusions: - Rent Amount: £700.00 per month (£161.54 per week) - Deposit / Bond: £700.00 - 1 Bedrooms - 1 Bathrooms - Property comes furnished - Available to move in from 28 December, 2017 - Minimum tenancy term is 6 months - Maximum number of tenants is 1 - No DSS / Housing Benefit Applicants - No Students - No Pets, sorry - Smokers considered - Family Friendly - Bills Included - No Parking Available - Property has garden access If calling, please quote reference: 321934 Fees: You will not be charged any admin fees. Referencing for tenants only costs £20 each, if requested by the landlord for this property. ** Contact today to book a viewing and have the landlord show you round! ** Request Details form responded to 24/7, with phone bookings available 9am-9pm, 7 days a week. OpenRent Ref: 321934 Agent: OpenRent Agent Ref: Reference_Number_321934","1 Bedroom In Laleham Road, London, Se6",https://www.gumtree.com/p/property-to-rent/1-bedroom-in-laleham-road-london-se6/1280300106,[700.0],easy,https://i.ebayimg.com/00/s/NjgyWDEwMjQ=/z/2AYAAOSwUMxaP7ZY/$_86.JPG,umair-ThinkPad-T420,properties,,,"Lewisham, London","[datetime.datetime(2017, 12, 28, 18, 18, 13, 542952)]"
"- No Agent Fees - Property Reference Number: 321891 Unfurnished semi-detached 3 bedroom family home with a large garden, lounge, dining room and separate kitchen. * Large lounge/dining room * Fitted kitchen * Front and back gardens * Gas central heating * Off-street parking * Two garden sheds for additional storage New carpet in lounge and master bedroom. Close to local shops and bus links. Sorry but no smokers, students or DSS please. Please apply via OpenRent only. There is a £20 fee per tenant for references, no other fees apply. Summary & Exclusions: - Rent Amount: £1,300.00 per month (£300.00 per week) - Deposit / Bond: £1,300.00 - 3 Bedrooms - 1 Bathrooms - Property comes unfurnished - Available to move in from 28 December, 2017 - Minimum tenancy term is 6 months - Maximum number of tenants is 3 - No DSS / Housing Benefit Applicants - No Students - Pets considered / by arrangement - No Smokers - Family Friendly - Bills not included - Property has parking - Property has garden access - EPC Rating: D If calling, please quote reference: 321891 Fees: You will not be charged any admin fees. Referencing for tenants only costs £20 each, if requested by the landlord for this property. ** Contact today to book a viewing and have the landlord show you round! ** Request Details form responded to 24/7, with phone bookings available 9am-9pm, 7 days a week. OpenRent Ref: 321891 Agent: OpenRent Agent Ref: Reference_Number_321891","3 Bedroom House In Poynings Drive, Hove, Bn3 (3 Bed)",https://www.gumtree.com/p/property-to-rent/3-bedroom-house-in-poynings-drive-hove-bn3-3-bed-/1280207304,[1300.0],easy,https://i.ebayimg.com/00/s/NjgyWDEwMjQ=/z/T1gAAOSw~B1aOn1Q/$_86.JPG,umair-ThinkPad-T420,properties,,,"Hove, East Sussex","[datetime.datetime(2017, 12, 28, 18, 18, 13, 600757)]"
"Located within a short walk of Ilford Overground Rail Station and the High Street with a fantastic array of Shops, Restaurants, Bars and Cafes. Plethora of good schools within easy reach including Christchurch. The property is presented in excellent order and has been refurbished to an excellent standard throughout, with NEW Kitchen and Shower Room. Unusually large private garden to rear and Off Street Parking for one car to front aspect. Newly painted with new laminate floors and a wonderful new plastered finish . Agent: Hills Estate Agent Ref: 8253_753","2 Bedroom Flat In Ingleby Road, Ilford",https://www.gumtree.com/p/property-to-rent/2-bedroom-flat-in-ingleby-road-ilford/1269116716,[1125.0],easy,https://i.ebayimg.com/00/s/NjgyWDEwMjQ=/z/6C4AAOSw9mpaAvYZ/$_86.JPG,umair-ThinkPad-T420,properties,,,"Redbridge, London","[datetime.datetime(2017, 12, 28, 18, 18, 13, 620807)]"
"Atco Estates Presents Nice Three Bedroom House in Dagenham RM8 Description: 3 Room upstairs Family size Bathroom Ground Floor/WC One Good Size Reception Large Garden 2 Cars Driveway Near to Local Amenities.  Book an Appointment Contact : ATCO ESTATES LTD  704 Green Lane Dagenham RM8 1YX 02085994557  Administration Fees applies while renting a property in England, Wales and Northern Ireland. Please contact on our office number for more details.",Nice 3 Bedroom House In Dagenham Rm8,https://www.gumtree.com/p/property-to-rent/nice-3-bedroom-house-in-dagenham-rm8-/1170210451,[1500.0],easy,https://i.ebayimg.com/00/s/NzY4WDEwMjQ=/z/82YAAOSw-itXqhN8/$_86.JPG,umair-ThinkPad-T420,properties,,,"Barking, London","[datetime.datetime(2017, 12, 28, 18, 18, 13, 640407)]"
"Hi There!!  Atco estates present this beautiful Family house in Sevenking Ilford  Property Consist:  Three Double Room  One Large Through Lounge  Good size Kitchen  Tiled Bathroom  All house newly Carpeted and painted  Drive Way for one car park  For Appointment Contact: Atco Estates Ltd 704 Green Lane Dagenham RM8 1YX 02085994557  Administration Fees applies while renting a property in England, Wales and Northern Ireland. Please contact on our office number for more details.",** A Beautiful Three Bed House In Sevenking Green Lane****,https://www.gumtree.com/p/property-to-rent/-a-beautiful-three-bed-house-in-sevenking-green-lane-/1138796460,[1600.0],easy,https://i.ebayimg.com/00/s/MTAyNFg3Njg=/z/6AwAAOSw5VFWJ39o/$_86.JPG,umair-ThinkPad-T420,properties,,,"Ilford, London","[datetime.datetime(2017, 12, 28, 18, 18, 13, 786996)]"
"Nice One Bedroom First Floor Flat in Ilford One Double Room Open Plan Kitchen Family size Bathroom Dss welcome with Guarantor Ready to Move  Book an Appointment Atco Estates Ltd 704 Green Lane, Dagenham RM8 1YX Office: 02085994557  Administration Fees applies while renting a property in England, Wales and Northern Ireland. Please call on our office number to know more details.",Nice One Bed Flat In Ilford,https://www.gumtree.com/p/property-to-rent/nice-one-bed-flat-in-ilford/1176266176,[1075.0],easy,https://i.ebayimg.com/00/s/NzY4WDEwMjQ=/z/Bz8AAOSwgZ1XsEfk/$_86.JPG,umair-ThinkPad-T420,properties,,,"Ilford, London","[datetime.datetime(2017, 12, 28, 18, 18, 13, 879793)]"
"Atco Estates are pleased to offer this three Bed House 2 minutes walk from the Chadwel Heath Station. Property is Ideal for a working professional family of not more then 5 people.  Property Comprises of:- One Big Reception One Family Size Kitchen with Gas Hob Two Double Bedrooms (upstaris) One Single Bedroom (upstairs) One Family Bathroom (downstairs) Garden One Standing Shower Bathroom (upstairs) Driveway for 3 Cars  For Viewing and more details. Please contact the following office.  Atco Estates Ltd 704 Green Lane Dagenham  Administration fees applies while renting a property in England, Wales and Northern Ireland. Please call our office for more details.",Three Bed House Close To Chadwel Heath Station,https://www.gumtree.com/p/property-to-rent/three-bed-house-close-to-chadwel-heath-station/1233235722,[1600.0],easy,https://i.ebayimg.com/00/s/NzY4WDEwMjQ=/z/c0wAAOSwRUhY-I4N/$_86.JPG,umair-ThinkPad-T420,properties,,,"Romford, London","[datetime.datetime(2017, 12, 28, 18, 18, 13, 963855)]"
"Atco Estates are pleased to offer this 3 bedroom ground floor flat in the heart of Chadwel Heath Lane very close to all local amenities and transport links. Property comprises of :-  One Big Size Open Plan Reception Fitted Kitchen One master Bedroom One double bedroom One Single Bedroom Garden All Laminate Flooring Ready to move in White goods only Separate Entrance Dss accepted with 2 months rent in advance and one month of deposit  for viewing and more details please call Atco Estates Ltd 704 Green Lane Dagenham, RM8 1YX Ph:- 02085994557  Admininstration Fees applies while renting a property in England, Wales and Northern Ireland. Please call on our office number for more details. ",Newly Built Three Bed Ground Floor Flat In Chadwell Heath,https://www.gumtree.com/p/property-to-rent/newly-built-three-bed-ground-floor-flat-in-chadwell-heath/1196509128,[1500.0],easy,https://i.ebayimg.com/00/s/NzY4WDEwMjQ=/z/GBAAAOSwA3dYFMQh/$_86.JPG,umair-ThinkPad-T420,properties,,,"Romford, London","[datetime.datetime(2017, 12, 28, 18, 18, 14, 2264)]"
"Property Comprises of:-  One Good Size Reception Area One Good Size Family Bathroom ( Downstairs ) Garden Driveway for 2 Cars One Master Bedroom One Good Size Double Bedroom One Single Bedroom Un-Furnished Gas Central Heating Ready to move in All Laminate Fooring Dss accepted  For Viewings and More details please call our office number for more details.  Atco Estates Ltd 704 Green Lane Dagenham RM8 1YX  Administration Fees applies while renting a property in England, Wales and Northern Ireland. Please call us to get more details. ",Three Bed Newly Refurbished House In Dagenham,https://www.gumtree.com/p/property-to-rent/three-bed-newly-refurbished-house-in-dagenham/1265277539,[1500.0],easy,https://i.ebayimg.com/00/s/NzY4WDEwMjQ=/z/LjoAAOSw9YNZsowJ/$_86.JPG,umair-ThinkPad-T420,properties,,,"Dagenham, London","[datetime.datetime(2017, 12, 28, 18, 18, 14, 32673)]"
"Atco Estates are proud to offer this two bed 1st Floor Flat very close to Green Lane, Ilford area. This property comprises on the following:-  Open Plan Reception One Double Bedroom One Good Size Medium Bedroom Good Family Size Bathroom Kitchen is open with the reception with all the fitted appliances Fully Furnished  Dss accepted with 2 months rent in advance and one month of deposit An ideal property for those who want to save money for their future property.  for Viewings and more details Call on  Atco Estates Ltd 704 Green Lane, Dangenham RM8 1YX Ph:- 02085994557  Administration Fees applies while renting a property in England, Wales and Northern Ireland. Please call our office number for more details.",Two Bed 1St Floor Flat,https://www.gumtree.com/p/property-to-rent/two-bed-1st-floor-flat-/1189854186,[1350.0],easy,https://i.ebayimg.com/00/s/NzY4WDEwMjQ=/z/6oAAAOSwTA9X58m8/$_86.JPG,umair-ThinkPad-T420,properties,,,"Redbridge, London","[datetime.datetime(2017, 12, 28, 18, 18, 14, 88637)]"
"Atco Estates are pleased to offer this 1st Floor Massionate in the heart of Chadwel Heath at the edge of A12.  Property comprises of:- One Big Reception with Laminate Flooring Big Size Kitchen with Gas Hob Two Double Bedrooms ( 2nd floor ) Family Size Bathroom with Bath Tub Ready to move in Newly Renovated Furnished / Un-furnished Brand New Carpet on the Stairs Ideal for a Family of four people or Two couples. Dss accepted with 2 months rent in advance and one month of deposit. for Viewings and more details please contact  Atco Estates Ltd 704 Green Lane, Dagenham, RM8 1YX Ph:- 02085994557  Administration Fees applies while renting a property in England, Wales and Northern Ireland. Please contact our office number for more details.",Two Bed First Floor Massionate Close To A12 In Chadwel Heath,https://www.gumtree.com/p/property-to-rent/two-bed-first-floor-massionate-close-to-a12-in-chadwel-heath-/1188431917,[1300.0],easy,https://i.ebayimg.com/00/s/NzY4WDEwMjQ=/z/ZsIAAOSw8w1X3Yh~/$_86.JPG,umair-ThinkPad-T420,properties,,,"Romford, London","[datetime.datetime(2017, 12, 28, 18, 18, 14, 126047)]"
"ATCO ESTATES LTD are proud to present this beautiful 2 Double Bedrooms & 1 Big Reception room on 2nd floor Flat in Medway Court Whalebone Ln South RM8.  Features:  * 2 Double Bedrooms. *1 Reception room * Family Size Bathroom. * Newly Fitted Kitchen. * Free Parking. * Newly refurbished. * Gas Central Heating. * Double Glazed Windows. * Short walk to all local amenities. * 24 Hours Local Bus Service  Contact  ATCO ESTATES LTD  704 Green Lane Dagenham RM8 1YX 02085994557  Administration Fees applies while renting a property in England, Wales and Northern Ireland. Please call our office number for more details. ",***** 2 Double Bedrooms Flat 2Nd Floor Flat Close To Robert Clack School Rm8 ****,https://www.gumtree.com/p/property-to-rent/-2-double-bedrooms-flat-2nd-floor-flat-close-to-robert-clack-school-rm8-/1178127532,[1350.0],easy,https://i.ebayimg.com/00/s/MTAyNFg3Njg=/z/JNUAAOSw0kNXhP3s/$_86.JPG,umair-ThinkPad-T420,properties,,,"Romford, London","[datetime.datetime(2017, 12, 28, 18, 18, 14, 173013)]"
"Atco Estates are pleased to offer this newly refurbished three bed house in the heart of Ilford. Property is ideal for a family of not more then 6 people.  Property Comprises Of:- One Big Size Reception area ( Can be used as Bedroom ) One Big Size Dinning Area Big Brand New Kitchen Bathroom ( Down stairs ) Two Double Bedrooms ( 1st Floor ) One Single Bedroom ( 1st Floor ) Garden Ready to move in Dss accepted with 2 months deposit and one month rent in advance   For more details Please call our office number  Atco Estates Ltd 704 Green Lane, Dagenham  Administration Fees applies while renting a property in England, Wales and Northern Ireland. Please call our office number for more details.",Three Bed House Close To Ilford Lane,https://www.gumtree.com/p/property-to-rent/three-bed-house-close-to-ilford-lane/1257406107,[1750.0],easy,https://i.ebayimg.com/00/s/MzJYMzI=/z/3HsAAOSwZANZebUL/$_86.JPG,umair-ThinkPad-T420,properties,,,"Barking, London","[datetime.datetime(2017, 12, 28, 18, 18, 14, 260464)]"
"Fantastic two bedroom flat arranged on the second floor Set within a well located purpose-built block Bright and spacious reception room with wood flooring  Lovely modern fitted kitchen Features two generous, well presented bedroom Benefits from off-street parking Located moments away from the local amenities of Wood Green Property description Ideally situated on a quiet residential street in Wood Green, this well presented two bedroom flat features a bright and spacious reception room and is set in a purpose-built block with communal gardens and parking.  Located on Eastern Road, the property is close to an excellent selection of shops, bars and restaurants in Wood Green. Transport links include Alexandra Palace Station (National Rail) and Bounds Green Underground Station (Piccadilly Line)","2 Bed Flat To Rent Eastern Road, Wood Green N22 7Dd",https://www.gumtree.com/p/property-to-rent/2-bed-flat-to-rent-eastern-road-wood-green-n22-7dd/1280798901,[1218.0],easy,https://i.ebayimg.com/00/s/MTAyNFg2Nzg=/z/U50AAOSwxzdaRO6L/$_86.JPG,umair-ThinkPad-T420,properties,,,"Wood Green, London","[datetime.datetime(2017, 12, 28, 18, 18, 14, 328658)]"
"Winkworth are happy to introduce a large Victorian terrace house to the rental market. Comprising of a double bay fronted reception room with original wooden flooring throughout, rear kitchen/dinner with bi-folding doors leading to a south facing private garden. There is also separate utility room and w/c on the ground floor. The first floor consists of three double bedrooms with ample storage and two separate washrooms (bath and shower). On the same floor you will also find a small room that can be used as either a single bedroom or office. The top floor comprises a full height double bedroom with en-suite shower room and plenty of storage. The house had all new plumbing and wiring in 2012, including a sealed heating system. There is also underfloor heating in the kitchen and utility room and in the two first floor bathrooms This family home is available in February and offered Unfurnished. Agent: Baz Trading And Investments Ta Winkworth Kensal Rise Agent Ref: 67081432_KQP150620_L","4 Bedroom House In Creighton Road, London, Nw6",https://www.gumtree.com/p/property-to-rent/4-bedroom-house-in-creighton-road-london-nw6/1267285683,[1350.0],easy,https://i.ebayimg.com/00/s/NjgzWDEwMjQ=/z/1koAAOSwY~laOnw8/$_86.JPG,umair-ThinkPad-T420,properties,,,"Kilburn, London","[datetime.datetime(2017, 12, 28, 18, 18, 14, 497950)]"
